{
  "id": "NN:state:brihadisvara:gap-001",
  "entity_id": "NN:site:brihadisvara-thanjavur",
  "label": "Unsupported requested period",
  "valid_from": null,
  "valid_to": null,
  "state_kind": "GAP",
  "reconstruction_method": null,
  "asset_refs": [],
  "evidence_refs": [],
  "uncertainty": {
    "code": "NO_SUPPORTED_RECONSTRUCTION",
    "message": "No reviewed historical reconstruction is currently available for the requested interval in the current project dataset."
  },
  "verification_status": "UNREVIEWED",
  "notes": "Fixture demonstrating explicit data-gap behavior. Do not substitute a nearby historical model."
}
